<!ELEMENT Food (Item+)>
<!ELEMENT Item EMPTY>
<!ATTLIST Item id NMTOKEN #REQUIRED>
<!ATTLIST Item name NMTOKEN #REQUIRED>
<!ATTLIST Item type (Conveyor|Machine|None) #REQUIRED>
<!ATTLIST Item pan NMTOKEN #IMPLIED>
<!ATTLIST Item pot NMTOKEN #IMPLIED>
<!ATTLIST Item oven NMTOKEN #IMPLIED>